{
  "version": "1.0",
  "name": "Splits example",
  "description": "Demonstrates split markers for phase transitions",
  "config": {
    "totalTicks": 25,
    "rowOrder": ["boss", "p1"]
  },
  "timeline": {
    "actors": [
      { "type": "npc", "id": "boss", "npcId": 99999, "name": "Lil Zik" },
      { "type": "player", "id": "p1", "name": "Player" }
    ],
    "ticks": [
      {
        "tick": 1,
        "cells": [
          {
            "actorId": "p1",
            "actions": [
              {
                "type": "attack",
                "attackType": "SCYTHE",
                "weaponId": 22325,
                "targetActorId": "boss"
              }
            ]
          }
        ]
      },
      {
        "tick": 6,
        "cells": [
          {
            "actorId": "p1",
            "actions": [
              {
                "type": "attack",
                "attackType": "SCYTHE",
                "weaponId": 22325,
                "targetActorId": "boss"
              }
            ]
          }
        ]
      },
      {
        "tick": 11,
        "cells": [
          {
            "actorId": "boss",
            "actions": [
              {
                "type": "npcAttack",
                "attackType": "TOB_VERZIK_P2_CABBAGE",
                "targetActorId": "p1"
              }
            ]
          }
        ]
      },
      {
        "tick": 15,
        "cells": [
          {
            "actorId": "p1",
            "actions": [
              {
                "type": "attack",
                "attackType": "SCYTHE",
                "weaponId": 22325,
                "targetActorId": "boss"
              }
            ]
          }
        ]
      },
      {
        "tick": 21,
        "cells": [
          {
            "actorId": "boss",
            "actions": [
              {
                "type": "npcAttack",
                "attackType": "TOB_VERZIK_P3_MELEE",
                "targetActorId": "p1"
              }
            ]
          }
        ]
      }
    ]
  },
  "augmentation": {
    "splits": [
      { "tick": 1, "name": "Fight Start" },
      { "tick": 10, "name": "Phase 2" },
      { "tick": 20, "name": "Enrage" }
    ]
  }
}
