{
  "version": "1.0",
  "name": "Mokhaiotl orbs",
  "description": "Example BCF document using a custom row for orbs.",
  "config": {
    "totalTicks": 24,
    "startTick": 1,
    "rowOrder": ["mokhaiotl", "mokhaiotl-orbs", "p1"]
  },
  "timeline": {
    "actors": [
      {
        "type": "npc",
        "id": "mokhaiotl",
        "npcId": 14707,
        "name": "Mokhaiotl"
      },
      {
        "type": "player",
        "id": "p1",
        "name": "Player"
      }
    ],
    "ticks": [
      {
        "tick": 1,
        "cells": [
          {
            "actorId": "p1",
            "actions": [
              {
                "type": "attack",
                "attackType": "TWISTED_BOW",
                "weaponId": 20997,
                "targetActorId": "mokhaiotl"
              }
            ]
          }
        ]
      },
      {
        "tick": 5,
        "cells": [
          {
            "actorId": "mokhaiotl",
            "actions": [
              {
                "type": "npcAttack",
                "attackType": "MOKHAIOTL_MELEE_AUTO",
                "targetActorId": "p1"
              }
            ]
          }
        ]
      },
      {
        "tick": 6,
        "cells": [
          {
            "actorId": "p1",
            "actions": [
              {
                "type": "attack",
                "attackType": "TWISTED_BOW",
                "weaponId": 20997,
                "targetActorId": "mokhaiotl"
              }
            ]
          }
        ]
      },
      {
        "tick": 10,
        "cells": [
          {
            "actorId": "mokhaiotl",
            "actions": [
              {
                "type": "npcAttack",
                "attackType": "MOKHAIOTL_RANGED_AUTO",
                "targetActorId": "p1"
              }
            ]
          }
        ]
      },
      {
        "tick": 11,
        "cells": [
          {
            "actorId": "p1",
            "actions": [
              {
                "type": "attack",
                "attackType": "TWISTED_BOW",
                "weaponId": 20997,
                "targetActorId": "mokhaiotl"
              }
            ]
          }
        ]
      },
      {
        "tick": 15,
        "cells": [
          {
            "actorId": "mokhaiotl",
            "actions": [
              {
                "type": "npcAttack",
                "attackType": "MOKHAIOTL_MAGE_AUTO",
                "targetActorId": "p1"
              }
            ]
          }
        ]
      },
      {
        "tick": 16,
        "cells": [
          {
            "actorId": "p1",
            "actions": [
              {
                "type": "attack",
                "attackType": "TWISTED_BOW",
                "weaponId": 20997,
                "targetActorId": "mokhaiotl"
              }
            ]
          }
        ]
      },
      {
        "tick": 21,
        "cells": [
          {
            "actorId": "p1",
            "actions": [
              {
                "type": "attack",
                "attackType": "TWISTED_BOW",
                "weaponId": 20997,
                "targetActorId": "mokhaiotl"
              }
            ]
          }
        ]
      }
    ]
  },
  "augmentation": {
    "customRows": [
      {
        "id": "mokhaiotl-orbs",
        "name": "Mokhaiotl orbs",
        "cells": [
          {
            "tick": 8,
            "iconUrl": "https://blert.io/images/mokhaiotl/melee-orb.png",
            "opacity": 0.5
          },
          {
            "tick": 13,
            "label": "RNG",
            "opacity": 0.5
          },
          {
            "tick": 18,
            "iconUrl": "https://blert.io/images/mokhaiotl/magic-orb.png",
            "label": "MAG",
            "opacity": 0.5
          }
        ]
      }
    ]
  }
}
